Title,Link,Semester,Credits,Comments,Assessment_1,Timing_1,Open Book Exam_1,Component Scale_1,Must Pass_1,Percentage_1,Assessment_2,Timing_2,Open Book Exam_2,Component Scale_2,Must Pass_2,Percentage_2,Assessment_3,Timing_3,Open Book Exam_3,Component Scale_3,Must Pass_3,Percentage_3,Assessment_4,Timing_4,Open Book Exam_4,Component Scale_4,Must Pass_4,Percentage_4,Assessment_5,Timing_5,Open Book Exam_5,Component Scale_5,Must Pass_5,Percentage_5
Advanced Data Structures in Java (online) (COMP47500),https://www.ucd.ie/modules/comp47500,2,10, ,Continuous Assessment: Advanced Data Structures portfolio of assignments during the semester,Varies over the Trimester,n/a,Graded,No,100
Technical Communication (online) (MEEN40820),https://www.ucd.ie/modules/MEEN40820,1,5,*** FULL *** ,Group Project: Group presentation and report critiquing two communication samples.,Week 7,n/a,Graded,No,30,"Project: Presentation outline plan, audience analysis and visual samples. Done individually.",Week 4,n/a,Graded,No,20,Group Project: Presentation and report (on presentation plan) on a technical topic.,Week 11,n/a,Graded,No,30,Class Test: In-semester exam on course theory.,Week 9,n/a,Graded,No,20
Bioinformatics (COMP40400),https://www.ucd.ie/modules/COMP40400,2,5,,Assignment: Protein structure prediction assignment,Week 10,n/a,Graded,No,10,Assignment: Public tools and databases assignment,Week 8,n/a,Graded,No,10,Assignment: Phylogeny assignment,Week 6,n/a,Graded,No,10,"Examination: final exam, two hours",2 hour End of Trimester Exam,No,Graded,No,60,Assignment: Dynamic programming assignment,Week 3,n/a,Graded,No,10
Introduction to Information Security (COMP41280),https://www.ucd.ie/modules/comp41280,2 ,5 ,,Continuous Assessment: Practical and Theoretical Assignments/Tests,Varies over the Trimester,n/a,Alternative linear conversion grade scale 40%,No,100
Ethical Hacking (COMP47860),https://www.ucd.ie/modules/comp47860,2 ,5 ,For Negotiated Learning MSc students only,Continuous Assessment: Case Study,Varies over the Trimester,n/a,Graded,No,20,Project: Penetration Testing Report,Coursework (End of Trimester),n/a,Graded,No,40,Multiple Choice Questionnaire: Multiple Choice Quiz,End of trimester MCQ,n/a,Graded,No,40
Leading Teams in the Scientific Enterprise (BMOL30100),https://www.ucd.ie/modules/BMOL30100,2,5,Level 3 module,Assignment: Case study assignment,Week 12,n/a,Graded,No,50,Assignment: Biweekly Assignments,Throughout the Trimester,n/a,Graded,No,50
Business Planning for the Scientific Enterprise (BMOL40350),https://www.ucd.ie/modules/BMOL40350,2,5,,Assignment: Case Study,Week 12,n/a,Graded,No,50,Assignment: Biweekly Assignments,Throughout the Trimester,n/a,Graded,No,50
"Law, Finance, and Technology (LAW42060)",https://www.ucd.ie/modules/LAW42060,2,10,*** CANCELLED*** 
Technical Communication (MEEN40670),https://www.ucd.ie/modules/MEEN40670,2,5,,Continuous Assessment: In-class engagement exercises x10.,Throughout the Trimester,n/a,Graded,No,10,"Group Project: Communication Exercise 3: Give short presentation on a technical topic of their choice using tools: analogies, examples, demo’s, stories, graphs, videos, visuals, interaction. Also 1500-word report.",Week 11,n/a,Graded,No,25,"Group Project: Communication Exercise 1: This will involve groups choosing a topic, and then delivering a 5-minute presentation and a 1000-word report on this topic.",Week 4,n/a,Graded,No,20,Class Test: In-class theory exam.,Week 9,n/a,Graded,No,20,"Group Project: Communication Exercise 2: Each group slects both static (newspaper, magazine, book) and dynamic (video, presentation) communication and appraises each via short presentation & a 1500-word report.",Week 7,n/a,Graded,No,25
Decision Analytics (MIS30010),https://www.ucd.ie/modules/MIS30010,2,5,Level 3 module,Journal: Learning Journal,Week 12,n/a,Graded,No,40,Presentation: Group Presentation on Class Reading,Throughout the Trimester,n/a,Graded,No,15,Continuous Assessment: In Class Tests Continuous Assessment throughout term,Week 9,n/a,Graded,No,45
COMP40070,https://www.ucd.ie/modules/comp40070,Autumn,Sept 2022,10 ,Continuous Assessment: Lab exercises and reports.,Varies over the Trimester,n/a,Graded,No,70,Assignment: Warm-up programming exercise,Varies over the Trimester,n/a,Pass/Fail Grade Scale,No,0,Essay: Term paper on design patterns,Varies over the Trimester,n/a,Graded,No,30
